Keys,English,Vietnamese,Chinese (Simplified),$Chinese (Traditional),Japanese,French,German,Spanish,Portuguese [pt-PT],Arabic,Russian,Korean,Italian,Hindi,Philipine [tl],Indo,Thai,Turkis
TXT_TUTORIAL_CHAPTER_3_INTERACTION_2,Drag the Flame Furry and merge to make a 4 stars,Kéo Flame Furry và hợp nhất để tạo thành 4 sao,拖动火焰毛茸茸并合并以形成 4 颗星,,炎の毛皮をドラッグして結合して 4 つ星を作ります,Faites glisser le Flame Furry et fusionnez pour créer un 4 étoiles,"Ziehen Sie das Flammenfell und verschmelzen Sie es, um 4 Sterne zu erhalten",Arrastra Flame Furry y fusiona para formar 4 estrellas.,Arraste o Flame Furry e mescle para formar 4 estrelas,اسحب Flame Furry وادمجه لتكوين 4 نجوم,"Перетащите Flame Furry и объедините, чтобы получилось 4 звезды.",Flame Furry를 드래그하고 합쳐서 별 4개를 만드세요.,Trascina la Fiamma Furry e uniscila per creare un 4 stelle,फ्लेम फ़री को खींचें और 4 स्टार बनाने के लिए मर्ज करें,I-drag ang Flame Furry at pagsamahin upang makagawa ng 4 na bituin,Seret Flame Furry dan gabungkan untuk membuat 4 bintang,ลาก Flame Furry แล้วรวมเข้าด้วยกันเพื่อสร้าง 4 ดาว,Alev Tüylü'yü sürükleyin ve 4 yıldız oluşturmak için birleştirin
TXT_TUTORIAL_CHAPTER_3_STEP_1,You can merge the same type of Hero to upgrade.,Bạn có thể hợp nhất các Anh hùng cùng loại để nâng cấp.,可以合并同类型的英雄进行升级。,,同じタイプのヒーローを合成してアップグレードできます。,Vous pouvez fusionner le même type de héros pour le mettre à niveau.,"Sie können denselben Heldentyp zusammenführen, um ein Upgrade durchzuführen.",Puedes fusionar el mismo tipo de héroe para mejorar.,Você pode mesclar o mesmo tipo de herói para atualizar.,يمكنك دمج نفس نوع البطل للترقية.,Вы можете объединить героев одного типа для улучшения.,동일한 유형의 영웅을 병합하여 업그레이드할 수 있습니다.,Puoi unire lo stesso tipo di eroe per aggiornarlo.,अपग्रेड करने के लिए आप उसी प्रकार के हीरो को मर्ज कर सकते हैं।,Maaari mong pagsamahin ang parehong uri ng Hero para mag-upgrade.,Anda dapat menggabungkan jenis Pahlawan yang sama untuk ditingkatkan.,คุณสามารถรวมฮีโร่ประเภทเดียวกันเพื่ออัพเกรดได้,Yükseltmek için aynı türdeki Kahramanları birleştirebilirsiniz.
TXT_TUTORIAL_CHAPTER_3_STEP_2,"Excellent!
You've upgraded the Hero to 2 stars.","Xuất sắc!
Bạn đã nâng cấp Anh hùng lên 2 sao.","出色的！
您已将英雄升级至 2 星。",,"素晴らしい！
ヒーローを 2 つ星にアップグレードしました。","Excellent!
Vous avez amélioré le héros à 2 étoiles.","Exzellent!
Du hast den Helden auf 2 Sterne aufgewertet.","¡Excelente!
Has mejorado el héroe a 2 estrellas.","Excelente!
Você atualizou o herói para 2 estrelas.","ممتاز!
لقد قمت بترقية البطل إلى نجمتين.","Отличный!
Вы повысили Героя до 2 звезд.","훌륭한!
영웅을 별 2개로 업그레이드했습니다.","Eccellente!
Hai potenziato l'Eroe a 2 stelle.","उत्कृष्ट!
आपने हीरो को 2 स्टार तक अपग्रेड कर दिया है।","Magaling!
Na-upgrade mo ang Hero sa 2 star.","Bagus sekali!
Anda telah meningkatkan Pahlawan menjadi 2 bintang.","ยอดเยี่ยม!
คุณได้อัพเกรดฮีโร่เป็น 2 ดาว","Harika!
Kahramanı 2 yıldıza yükselttiniz."
TXT_TUTORIAL_CHAPTER_3_STEP_3,You can only merge with the same type of Hero and increase 1 star count at a time.,Bạn chỉ có thể hợp nhất với cùng loại Anh hùng và tăng số lượng 1 sao mỗi lần.,您只能与同类型的英雄合并并一次增加 1 颗星数。,,同じタイプのヒーローとのみ合体して、一度に 1 つ星の数を増やすことができます。,Vous ne pouvez fusionner qu’avec le même type de héros et augmenter le nombre d’étoiles à la fois.,Du kannst nur mit Helden desselben Typs fusionieren und die Anzahl der Sterne jeweils um 1 erhöhen.,Solo puedes fusionarte con el mismo tipo de héroe y aumentar el número de 1 estrella a la vez.,Você só pode fundir-se com o mesmo tipo de herói e aumentar a contagem de 1 estrela por vez.,يمكنك فقط الدمج مع نفس نوع البطل وزيادة عدد النجوم بمقدار نجمة واحدة في كل مرة.,Вы можете объединиться только с героем того же типа и увеличить количество звезд на 1 за раз.,"동일한 유형의 영웅과만 병합할 수 있으며, 한 번에 1개의 별 수를 늘릴 수 있습니다.",Puoi unirti solo con lo stesso tipo di eroe e aumentare il numero di stelle di 1 alla volta.,आप केवल एक ही प्रकार के हीरो के साथ विलय कर सकते हैं और एक बार में 1 स्टार की संख्या बढ़ा सकते हैं।,Maaari ka lang magsama sa parehong uri ng Hero at taasan ang 1 star count sa bawat pagkakataon.,Anda hanya dapat bergabung dengan jenis Pahlawan yang sama dan meningkatkan jumlah 1 bintang dalam satu waktu.,คุณสามารถรวมเข้ากับฮีโร่ประเภทเดียวกันเท่านั้น และเพิ่มจำนวนดาวได้ครั้งละ 1 ดวง,Yalnızca aynı türdeki Kahramanlarla birleşebilir ve tek seferde 1 yıldız sayısını artırabilirsiniz.
TXT_TUTORIAL_CHAPTER_4_INTERACTION_1,Try tapping the opponent's Steel Blader.,Hãy thử chạm vào Steel Blader của đối thủ.,尝试点击对手的钢刃。,,相手のスティール・ブレーダーをタップしてみましょう。,Essayez d'appuyer sur le Steel Blader de l'adversaire.,"Versuchen Sie, auf den Steel Blader des Gegners zu tippen.",Intenta tocar el Steel Blader del oponente.,Tente virar o Steel Blader do oponente.,حاول النقر على الشفرة الفولاذية للخصم.,Попробуйте коснуться Стального клинка противника.,상대의 스틸 블레이더를 탭해 보세요.,Prova a toccare lo Steel Blader dell'avversario.,प्रतिद्वंद्वी के स्टील ब्लेडर को टैप करने का प्रयास करें।,Subukang i-tap ang Steel Blader ng kalaban.,Coba ketuk Steel Blader lawan.,ลองแตะ Steel Blader ของคู่ต่อสู้,Rakibin Çelik Kılıç'ına dokunmayı deneyin.
TXT_TUTORIAL_CHAPTER_4_INTERACTION_2,Try tapping the Wind Dancer on your board.,Hãy thử chạm vào Wind Dancer trên bảng của bạn.,尝试点击板上的风舞者。,,ボード上のウィンドダンサーをタップしてみてください。,Essayez d'appuyer sur le Wind Dancer sur votre tableau.,"Versuchen Sie, den Windtänzer auf Ihrem Brett anzutippen.",Intenta tocar el Wind Dancer en tu tablero.,Tente tocar no Wind Dancer em seu tabuleiro.,حاول النقر على Wind Dancer على لوحتك.,Попробуйте коснуться Танцора Ветра на своей доске.,보드에서 Wind Dancer를 탭해 보세요.,Prova a toccare il Wind Dancer sulla tua tavola.,अपने बोर्ड पर विंड डांसर को टैप करने का प्रयास करें।,Subukang i-tap ang Wind Dancer sa iyong board.,Coba ketuk Penari Angin di papan Anda.,ลองแตะนักเต้นสายลมบนกระดานของคุณ,Tahtanızdaki Rüzgar Dansçısına dokunmayı deneyin.
TXT_TUTORIAL_CHAPTER_4_STEP_1,"Last but not least,
it's time to learn about attack range!","Cuối cùng nhưng không kém phần quan trọng,
đã đến lúc tìm hiểu về phạm vi tấn công!","最后但并非最不重要的，
是时候了解攻击范围了！",,"最後になりましたが、重要なことです、
攻撃範囲について学ぶ時が来ました!","Enfin et surtout,
il est temps d'en apprendre davantage sur la portée d'attaque !","Nicht zuletzt,
Es ist Zeit, etwas über die Angriffsreichweite zu lernen!","Por último, pero no menos importante,
¡Es hora de aprender sobre el rango de ataque!","Por último, mas não menos importante,
é hora de aprender sobre o alcance do ataque!","أخيراً وليس آخراً،
حان الوقت للتعرف على نطاق الهجوم!","Последний, но тем не менее важный,
пришло время узнать о дальности атаки!","마지막으로 중요한 것은,
이제 공격 범위에 대해 알아볼 차례입니다!","Ultimo, ma non per importanza,
è ora di conoscere il raggio d'attacco!","आखिरी बात भी बहुत महत्वपूर्ण है,
अब हमले की सीमा के बारे में जानने का समय आ गया है!","Huli ngunit hindi bababa sa,
oras na para malaman ang tungkol sa saklaw ng pag-atake!","Terakhir, tetapi tidak kalah penting,
saatnya belajar tentang jangkauan serangan!","สุดท้ายแต่ไม่ท้ายสุด
ถึงเวลาเรียนรู้เกี่ยวกับระยะการโจมตีแล้ว!","En son ama en kötü değil,
Saldırı menzilini öğrenmenin zamanı geldi!"
TXT_TUTORIAL_CHAPTER_4_STEP_2,You can tap on any Hero on the board to check the attack range.,Bạn có thể chạm vào bất kỳ Anh hùng nào trên bảng để kiểm tra phạm vi tấn công.,您可以点击面板上的任意英雄来查看攻击范围。,,ボード上のヒーローをタップして攻撃範囲を確認できます。,Vous pouvez appuyer sur n'importe quel héros du tableau pour vérifier la portée d'attaque.,"Sie können auf einen beliebigen Helden auf dem Spielbrett tippen, um die Angriffsreichweite zu überprüfen.",Puedes tocar cualquier héroe en el tablero para verificar el rango de ataque.,Você pode tocar em qualquer herói no tabuleiro para verificar o alcance do ataque.,يمكنك النقر على أي بطل على اللوحة للتحقق من نطاق الهجوم.,"Вы можете нажать на любого героя на доске, чтобы проверить дальность атаки.",보드에 있는 영웅을 탭하여 공격 범위를 확인할 수 있습니다.,Puoi toccare qualsiasi eroe sul tabellone per controllare il raggio di attacco.,आक्रमण सीमा की जांच करने के लिए आप बोर्ड पर किसी भी हीरो पर टैप कर सकते हैं।,Maaari kang mag-tap sa alinmang Hero sa board para tingnan ang hanay ng pag-atake.,Anda dapat mengetuk Pahlawan mana pun di papan untuk memeriksa jangkauan serangan.,คุณสามารถแตะที่ฮีโร่ตัวใดก็ได้บนกระดานเพื่อตรวจสอบระยะการโจมตี,Saldırı menzilini kontrol etmek için tahtadaki herhangi bir Kahramana dokunabilirsiniz.
TXT_TUTORIAL_CHAPTER_4_STEP_3,Steel Blader has a short attack range but can deal great damage.,Steel Blader có tầm tấn công ngắn nhưng có thể gây sát thương lớn.,钢铁刀锋的攻击距离较短，但可以造成巨大伤害。,,スティール・ブレーダーは攻撃範囲が狭いですが、大きなダメージを与えることができます。,Steel Blader a une courte portée d’attaque mais peut infliger de gros dégâts.,"Steel Blader hat eine kurze Angriffsreichweite, kann aber großen Schaden anrichten.",Steel Blader tiene un rango de ataque corto pero puede causar un gran daño.,"Steel Blader tem um alcance de ataque curto, mas pode causar grandes danos.",يتمتع Steel Blader بمدى هجوم قصير ولكنه يمكن أن يتسبب في أضرار جسيمة.,"Steel Blader имеет небольшую дальность атаки, но может нанести большой урон.",스틸 블레이더는 공격 범위가 짧지만 큰 데미지를 줄 수 있습니다.,Steel Blader ha un raggio di attacco breve ma può infliggere ingenti danni.,स्टील ब्लेडर की आक्रमण सीमा कम है लेकिन यह बड़ा नुकसान पहुंचा सकता है।,Ang Steel Blader ay may maikling hanay ng pag-atake ngunit makakapagdulot ng malaking pinsala.,Steel Blader memiliki jangkauan serangan yang pendek namun dapat memberikan damage yang besar.,Steel Blader มีระยะการโจมตีสั้น แต่สามารถสร้างความเสียหายได้มาก,Steel Blader'ın saldırı menzili kısadır ancak büyük hasar verebilir.
TXT_TUTORIAL_CHAPTER_4_STEP_4,Wind Dancer has a low attack value but can target faraway enemies.,Wind Dancer có giá trị tấn công thấp nhưng có thể nhắm mục tiêu vào kẻ thù ở xa.,风舞者攻击力低，但可以瞄准远处的敌人。,,ウィンドダンサーは攻撃値は低いですが、遠くの敵を狙うことができます。,Wind Dancer a une faible valeur d’attaque mais peut cibler des ennemis lointains.,"Wind Dancer hat einen niedrigen Angriffswert, kann aber weit entfernte Feinde angreifen.",Wind Dancer tiene un valor de ataque bajo pero puede apuntar a enemigos lejanos.,"Wind Dancer tem um valor de ataque baixo, mas pode atingir inimigos distantes.",تتمتع Wind Dancer بقيمة هجوم منخفضة ولكن يمكنها استهداف الأعداء البعيدين.,"Wind Dancer имеет низкую силу атаки, но может атаковать далеких врагов.",윈드 댄서는 공격력이 낮지만 멀리 있는 적을 공격할 수 있습니다.,Wind Dancer ha un valore di attacco basso ma può prendere di mira nemici lontani.,विंड डांसर का आक्रमण मूल्य कम है लेकिन यह दूर के दुश्मनों को निशाना बना सकता है।,Ang Wind Dancer ay may mababang halaga ng pag-atake ngunit maaaring mag-target ng malalayong kaaway.,Wind Dancer memiliki nilai serangan yang rendah namun dapat mengincar musuh yang berada jauh.,Wind Dancer มีค่าการโจมตีต่ำ แต่สามารถกำหนดเป้าหมายศัตรูที่อยู่ห่างไกลได้,Rüzgar Dansçısı'nın saldırı değeri düşüktür ancak uzaktaki düşmanları hedef alabilir.
TXT_TUTORIAL_CHAPTER_4_STEP_5,"If you place your Wind Dancer at a distant place from the Steel Blader,  
you can easily defeat your opponent!","Nếu bạn đặt Wind Dancer của mình ở một nơi xa Steel Blader,  
bạn có thể dễ dàng đánh bại đối thủ của mình!","如果你将风舞者放置在距离钢刃较远的地方，  
你可以轻松击败对手！",,"ウインドダンサーをスチールブレーダーから離れた場所に配置すると、  
簡単に相手を倒すことができます！","Si vous placez votre Wind Dancer à un endroit éloigné du Steel Blader,  
vous pouvez facilement vaincre votre adversaire !","Wenn Sie Ihren Wind Dancer an einem vom Steel Blader entfernten Ort platzieren,  
Sie können Ihren Gegner leicht besiegen!","Si colocas tu Wind Dancer en un lugar distante del Steel Blader,  
¡Puedes derrotar fácilmente a tu oponente!","Se você colocar seu Wind Dancer em um local distante do Steel Blader,  
você pode facilmente derrotar seu oponente!","إذا قمت بوضع راقصة الرياح الخاصة بك في مكان بعيد عن Steel Blader،  
يمكنك بسهولة هزيمة خصمك!","Если вы разместите Танцора Ветра вдали от Стального Клинка,  
вы можете легко победить своего противника!","스틸 블레이더와 멀리 떨어진 곳에 윈드 댄서를 배치할 경우,  
상대를 쉽게 이길 수 있어요!","Se posizioni il tuo Wind Dancer in un luogo distante dallo Steel Blader,  
puoi facilmente sconfiggere il tuo avversario!","यदि आप अपने विंड डांसर को स्टील ब्लेडर से दूर स्थान पर रखते हैं,  
आप अपने प्रतिद्वंद्वी को आसानी से हरा सकते हैं!","Kung ilalagay mo ang iyong Wind Dancer sa isang malayong lugar mula sa Steel Blader,  
madali mong talunin ang iyong kalaban!","Jika Anda menempatkan Penari Angin Anda di tempat yang jauh dari Pisau Baja,  
kamu dapat dengan mudah mengalahkan lawanmu!","หากคุณวาง Wind Dancer ของคุณไว้ในที่ห่างไกลจาก Steel Blader  
คุณสามารถเอาชนะคู่ต่อสู้ของคุณได้อย่างง่ายดาย!","Rüzgar Dansçınızı Çelik Kılıçtan uzak bir yere yerleştirirseniz,  
Rakibinizi kolayca yenebilirsiniz!"
TXT_TUTORIAL_CHAPTER_4_STEP_6,Now place your Hero freely on the board and claim victory!,Bây giờ hãy đặt Anh hùng của bạn một cách tự do lên bảng và giành chiến thắng!,现在将您的英雄自由地放置在棋盘上并获得胜利！,,今すぐヒーローをボード上に自由に配置し、勝利を勝ち取りましょう!,Placez maintenant librement votre héros sur le plateau et revendiquez la victoire !,Platzieren Sie nun Ihren Helden frei auf dem Spielbrett und erringen Sie den Sieg!,¡Ahora coloca a tu héroe libremente en el tablero y canta la victoria!,Agora coloque seu herói livremente no tabuleiro e conquiste a vitória!,الآن ضع بطلك بحرية على اللوحة وحقق النصر!,Теперь свободно разместите своего героя на доске и одержите победу!,이제 당신의 영웅을 보드에 자유롭게 배치하고 승리를 쟁취하세요!,Ora posiziona liberamente il tuo eroe sul tabellone e rivendica la vittoria!,अब अपने हीरो को स्वतंत्र रूप से बोर्ड पर रखें और जीत का दावा करें!,Ngayon ay malayang ilagay ang iyong Bayani sa board at i-claim ang tagumpay!,Sekarang tempatkan Pahlawan Anda dengan bebas di papan dan raih kemenangan!,ตอนนี้วางฮีโร่ของคุณอย่างอิสระบนกระดานและรับชัยชนะ!,Şimdi Kahramanınızı serbestçe tahtaya yerleştirin ve zaferi ilan edin!